[
  {
    "legacy_id": "1",
    "kind": "darts_item",
    "source_file": "config/patch/targets.json",
    "source_layer": "patched(targets)",
    "content_version": "5c30f76a0dbf5f0dbc59ec9cfc45fec4becd2f87afa93c934a4ca0bce2693fbc",
    "id": 1,
    "start_date": "2012-03-02 23:00:00",
    "items": [
      1061,
      1073,
      1071,
      1031,
      1058,
      1045
    ],
    "item_refs": [
      "1061",
      "1073",
      "1071",
      "1031",
      "1058",
      "1045"
    ],
    "extra_item": 1152,
    "extra_ref": "1152"
  },
  {
    "legacy_id": "2",
    "kind": "darts_item",
    "source_file": "config/patch/targets.json",
    "source_layer": "patched(targets)",
    "content_version": "5c30f76a0dbf5f0dbc59ec9cfc45fec4becd2f87afa93c934a4ca0bce2693fbc",
    "id": 2,
    "start_date": "2012-03-09 23:00:00",
    "items": [
      1062,
      1073,
      1029,
      1031,
      1023,
      1045
    ],
    "item_refs": [
      "1062",
      "1073",
      "1029",
      "1031",
      "1023",
      "1045"
    ],
    "extra_item": 1150,
    "extra_ref": "1150"
  },
  {
    "legacy_id": "3",
    "kind": "darts_item",
    "source_file": "config/patch/targets.json",
    "source_layer": "patched(targets)",
    "content_version": "5c30f76a0dbf5f0dbc59ec9cfc45fec4becd2f87afa93c934a4ca0bce2693fbc",
    "id": 3,
    "start_date": "2012-03-16 23:00:00",
    "items": [
      1061,
      1010,
      1029,
      1046,
      1023,
      1021
    ],
    "item_refs": [
      "1061",
      "1010",
      "1029",
      "1046",
      "1023",
      "1021"
    ],
    "extra_item": 1172,
    "extra_ref": "1172"
  },
  {
    "legacy_id": "4",
    "kind": "darts_item",
    "source_file": "config/patch/targets.json",
    "source_layer": "patched(targets)",
    "content_version": "5c30f76a0dbf5f0dbc59ec9cfc45fec4becd2f87afa93c934a4ca0bce2693fbc",
    "id": 4,
    "start_date": "2012-03-23 23:00:00",
    "items": [
      1075,
      1073,
      1048,
      1070,
      1059,
      1045
    ],
    "item_refs": [
      "1075",
      "1073",
      "1048",
      "1070",
      "1059",
      "1045"
    ],
    "extra_item": 1127,
    "extra_ref": "1127"
  },
  {
    "legacy_id": "5",
    "kind": "darts_item",
    "source_file": "config/patch/targets.json",
    "source_layer": "patched(targets)",
    "content_version": "5c30f76a0dbf5f0dbc59ec9cfc45fec4becd2f87afa93c934a4ca0bce2693fbc",
    "id": 5,
    "start_date": "2012-03-30 23:00:00",
    "items": [
      1075,
      1061,
      1071,
      1031,
      1063,
      1021
    ],
    "item_refs": [
      "1075",
      "1061",
      "1071",
      "1031",
      "1063",
      "1021"
    ],
    "extra_item": 1152,
    "extra_ref": "1152"
  },
  {
    "legacy_id": "6",
    "kind": "darts_item",
    "source_file": "config/patch/targets.json",
    "source_layer": "patched(targets)",
    "content_version": "5c30f76a0dbf5f0dbc59ec9cfc45fec4becd2f87afa93c934a4ca0bce2693fbc",
    "id": 6,
    "start_date": "2012-04-06 23:00:00",
    "items": [
      1074,
      1073,
      1067,
      1047,
      1063,
      1033
    ],
    "item_refs": [
      "1074",
      "1073",
      "1067",
      "1047",
      "1063",
      "1033"
    ],
    "extra_item": 1162,
    "extra_ref": "1162"
  },
  {
    "legacy_id": "7",
    "kind": "darts_item",
    "source_file": "config/patch/targets.json",
    "source_layer": "patched(targets)",
    "content_version": "5c30f76a0dbf5f0dbc59ec9cfc45fec4becd2f87afa93c934a4ca0bce2693fbc",
    "id": 7,
    "start_date": "2012-04-13 23:00:00",
    "items": [
      1141,
      1073,
      1047,
      1046,
      1055,
      1033
    ],
    "item_refs": [
      "1141",
      "1073",
      "1047",
      "1046",
      "1055",
      "1033"
    ],
    "extra_item": 1178,
    "extra_ref": "1178"
  },
  {
    "legacy_id": "8",
    "kind": "darts_item",
    "source_file": "config/patch/targets.json",
    "source_layer": "patched(targets)",
    "content_version": "5c30f76a0dbf5f0dbc59ec9cfc45fec4becd2f87afa93c934a4ca0bce2693fbc",
    "id": 8,
    "start_date": "2012-04-20 23:00:00",
    "items": [
      1112,
      1048,
      1070,
      1067,
      1124,
      1055
    ],
    "item_refs": [
      "1112",
      "1048",
      "1070",
      "1067",
      "1124",
      "1055"
    ],
    "extra_item": 1172,
    "extra_ref": "1172"
  },
  {
    "legacy_id": "9",
    "kind": "darts_item",
    "source_file": "config/patch/targets.json",
    "source_layer": "patched(targets)",
    "content_version": "5c30f76a0dbf5f0dbc59ec9cfc45fec4becd2f87afa93c934a4ca0bce2693fbc",
    "id": 9,
    "start_date": "2012-04-27 23:00:00",
    "items": [
      1112,
      1048,
      1070,
      1067,
      1124,
      1063
    ],
    "item_refs": [
      "1112",
      "1048",
      "1070",
      "1067",
      "1124",
      "1063"
    ],
    "extra_item": 1172,
    "extra_ref": "1172"
  },
  {
    "legacy_id": "10",
    "kind": "darts_item",
    "source_file": "config/patch/targets.json",
    "source_layer": "patched(targets)",
    "content_version": "5c30f76a0dbf5f0dbc59ec9cfc45fec4becd2f87afa93c934a4ca0bce2693fbc",
    "id": 10,
    "start_date": "2012-05-04 23:00:00",
    "items": [
      1112,
      1048,
      1073,
      1121,
      1055,
      1063
    ],
    "item_refs": [
      "1112",
      "1048",
      "1073",
      "1121",
      "1055",
      "1063"
    ],
    "extra_item": 1127,
    "extra_ref": "1127"
  },
  {
    "legacy_id": "11",
    "kind": "darts_item",
    "source_file": "config/patch/targets.json",
    "source_layer": "patched(targets)",
    "content_version": "5c30f76a0dbf5f0dbc59ec9cfc45fec4becd2f87afa93c934a4ca0bce2693fbc",
    "id": 11,
    "start_date": "2012-05-11 23:00:00",
    "items": [
      1074,
      1061,
      1047,
      1067,
      1063,
      1033
    ],
    "item_refs": [
      "1074",
      "1061",
      "1047",
      "1067",
      "1063",
      "1033"
    ],
    "extra_item": 1152,
    "extra_ref": "1152"
  },
  {
    "legacy_id": "12",
    "kind": "darts_item",
    "source_file": "config/patch/targets.json",
    "source_layer": "patched(targets)",
    "content_version": "5c30f76a0dbf5f0dbc59ec9cfc45fec4becd2f87afa93c934a4ca0bce2693fbc",
    "id": 12,
    "start_date": "2012-05-18 17:00:00",
    "items": [
      1141,
      1073,
      1070,
      1121,
      1055,
      1045
    ],
    "item_refs": [
      "1141",
      "1073",
      "1070",
      "1121",
      "1055",
      "1045"
    ],
    "extra_item": 1162,
    "extra_ref": "1162"
  },
  {
    "legacy_id": "13",
    "kind": "darts_item",
    "source_file": "config/patch/targets.json",
    "source_layer": "patched(targets)",
    "content_version": "5c30f76a0dbf5f0dbc59ec9cfc45fec4becd2f87afa93c934a4ca0bce2693fbc",
    "id": 13,
    "start_date": "2012-05-25 23:00:00",
    "items": [
      1112,
      1048,
      1047,
      1072,
      1033,
      1045
    ],
    "item_refs": [
      "1112",
      "1048",
      "1047",
      "1072",
      "1033",
      "1045"
    ],
    "extra_item": 1181,
    "extra_ref": "1181"
  },
  {
    "legacy_id": "14",
    "kind": "darts_item",
    "source_file": "config/patch/targets.json",
    "source_layer": "patched(targets)",
    "content_version": "5c30f76a0dbf5f0dbc59ec9cfc45fec4becd2f87afa93c934a4ca0bce2693fbc",
    "id": 14,
    "start_date": "2012-06-08 23:00:00",
    "items": [
      1075,
      1073,
      1047,
      1121,
      1055,
      1033
    ],
    "item_refs": [
      "1075",
      "1073",
      "1047",
      "1121",
      "1055",
      "1033"
    ],
    "extra_item": 1192,
    "extra_ref": "1192"
  },
  {
    "legacy_id": "15",
    "kind": "darts_item",
    "source_file": "config/patch/targets.json",
    "source_layer": "patched(targets)",
    "content_version": "5c30f76a0dbf5f0dbc59ec9cfc45fec4becd2f87afa93c934a4ca0bce2693fbc",
    "id": 15,
    "start_date": "2012-06-15 23:00:00",
    "items": [
      1169,
      1074,
      1070,
      1067,
      1072,
      1045
    ],
    "item_refs": [
      "1169",
      "1074",
      "1070",
      "1067",
      "1072",
      "1045"
    ],
    "extra_item": 1172,
    "extra_ref": "1172"
  },
  {
    "legacy_id": "16",
    "kind": "darts_item",
    "source_file": "config/patch/targets.json",
    "source_layer": "patched(targets)",
    "content_version": "5c30f76a0dbf5f0dbc59ec9cfc45fec4becd2f87afa93c934a4ca0bce2693fbc",
    "id": 16,
    "start_date": "2012-06-22 23:00:00",
    "items": [
      1101,
      1073,
      1047,
      1121,
      1033,
      1063
    ],
    "item_refs": [
      "1101",
      "1073",
      "1047",
      "1121",
      "1033",
      "1063"
    ],
    "extra_item": 1210,
    "extra_ref": "1210"
  },
  {
    "legacy_id": "17",
    "kind": "darts_item",
    "source_file": "config/patch/targets.json",
    "source_layer": "patched(targets)",
    "content_version": "5c30f76a0dbf5f0dbc59ec9cfc45fec4becd2f87afa93c934a4ca0bce2693fbc",
    "id": 17,
    "start_date": "2012-06-29 23:00:00",
    "items": [
      1141,
      1075,
      1071,
      1067,
      1072,
      1046
    ],
    "item_refs": [
      "1141",
      "1075",
      "1071",
      "1067",
      "1072",
      "1046"
    ],
    "extra_item": 1250,
    "extra_ref": "1250"
  },
  {
    "legacy_id": "18",
    "kind": "darts_item",
    "source_file": "config/patch/targets.json",
    "source_layer": "patched(targets)",
    "content_version": "5c30f76a0dbf5f0dbc59ec9cfc45fec4becd2f87afa93c934a4ca0bce2693fbc",
    "id": 18,
    "start_date": "2012-07-06 23:00:00",
    "items": [
      1169,
      1074,
      1047,
      1046,
      1055,
      1045
    ],
    "item_refs": [
      "1169",
      "1074",
      "1047",
      "1046",
      "1055",
      "1045"
    ],
    "extra_item": 1237,
    "extra_ref": "1237"
  },
  {
    "legacy_id": "19",
    "kind": "darts_item",
    "source_file": "config/patch/targets.json",
    "source_layer": "patched(targets)",
    "content_version": "5c30f76a0dbf5f0dbc59ec9cfc45fec4becd2f87afa93c934a4ca0bce2693fbc",
    "id": 19,